{
  "id": "rule-change.adding_a_restrictive_rule_applies_immediately",
  "kind": "rule-change",
  "description": "A new block rule applies at once.",
  "given": {
    "old": {
      "schemaVersion": 1,
      "revision": 1,
      "updatedAt": "2026-10-01T00:00:00Z",
      "rules": [
        {
          "id": "r-reddit",
          "target": {
            "kind": "site",
            "domain": "reddit.com"
          },
          "mode": "friction",
          "schedules": [],
          "enabled": true
        }
      ],
      "categories": [],
      "bedtime": {
        "enabled": true,
        "days": ["mon", "tue", "wed", "thu", "fri", "sat", "sun"],
        "start": "22:30",
        "end": "07:00",
        "warnMinutesBefore": 30
      },
      "workHours": {
        "days": ["mon", "tue", "wed", "thu", "fri"],
        "start": "09:00",
        "end": "17:30"
      }
    },
    "new": {
      "schemaVersion": 1,
      "revision": 2,
      "updatedAt": "2026-10-26T04:00:00Z",
      "rules": [
        {
          "id": "r-reddit",
          "target": {
            "kind": "site",
            "domain": "reddit.com"
          },
          "mode": "friction",
          "schedules": [],
          "enabled": true
        },
        {
          "id": "r-yt-shorts",
          "target": {
            "kind": "surface",
            "surface": "youtube.shorts"
          },
          "mode": "block",
          "schedules": [],
          "enabled": true
        }
      ],
      "categories": [],
      "bedtime": {
        "enabled": true,
        "days": ["mon", "tue", "wed", "thu", "fri", "sat", "sun"],
        "start": "22:30",
        "end": "07:00",
        "warnMinutesBefore": 30
      },
      "workHours": {
        "days": ["mon", "tue", "wed", "thu", "fri"],
        "start": "09:00",
        "end": "17:30"
      }
    },
    "now": "2026-10-26T15:00:00+11:00",
    "timeZone": "Australia/Sydney"
  },
  "then": {
    "effectiveToday": {
      "schemaVersion": 1,
      "revision": 2,
      "updatedAt": "2026-10-26T04:00:00Z",
      "rules": [
        {
          "id": "r-reddit",
          "target": {
            "kind": "site",
            "domain": "reddit.com"
          },
          "mode": "friction",
          "schedules": [],
          "enabled": true
        },
        {
          "id": "r-yt-shorts",
          "target": {
            "kind": "surface",
            "surface": "youtube.shorts"
          },
          "mode": "block",
          "schedules": [],
          "enabled": true
        }
      ],
      "categories": [],
      "bedtime": {
        "enabled": true,
        "days": ["mon", "tue", "wed", "thu", "fri", "sat", "sun"],
        "start": "22:30",
        "end": "07:00",
        "warnMinutesBefore": 30
      },
      "workHours": {
        "days": ["mon", "tue", "wed", "thu", "fri"],
        "start": "09:00",
        "end": "17:30"
      }
    },
    "effectiveFrom": null
  }
}
